URL,Version,Status,OIDs,Name,Title,Description,Used
https://www.medizininformatik-initiative.de/fhir/ext/modul-onko/CodeSystem/mii-cs-onko-operation-komplikation,2026.0.1,active,,MII_CS_Onko_Operation_Komplikationen,MII CS Onkologie Operation Komplikationen,"oBDS-spezifisches Codesystem für Klassifikation von Komplikationen während der OP","ValueSet/mii-vs-onko-operation-komplikation"
https://www.medizininformatik-initiative.de/fhir/ext/modul-onko/CodeSystem/mii-cs-onko-operation-urgency,2026.0.1,active,,MII_CS_Onko_Operation_Urgency,,"oBDS-basiertes Codesystem für die Modalität der Eingriffsdurchführung (Art des Eingriffs KR6)","ValueSet/mii-vs-onko-operation-urgency"
https://www.medizininformatik-initiative.de/fhir/ext/modul-onko/CodeSystem/mii-cs-onko-primaertumor-diagnosesicherung,2026.0.1,active,,MII_CS_Onko_Primaertumor_Diagnosesicherung,MII CS Onkologie Primärtumor Diagnosesicherung,"Codes für Primärtumor Diagnosesicherung, d.h. die höchste erreichte Diagnosesicherheit der Diagnose.","ValueSet/mii-vs-onko-primaertumor-diagnosesicherung"
https://www.medizininformatik-initiative.de/fhir/ext/modul-onko/CodeSystem/mii-cs-onko-prostata-postsurgical-complications,2026.0.1,active,,MII_CS_Onko_Prostata_Postsurgical_Complications,MII CS Onkologie Prostata Postoperative Komplikationen,"CodeSystem zur Darstellung des Vorhandenseins von postoperativen Komplikationen nach Prostatektomie in der Onkologie","ValueSet/mii-vs-onko-prostata-postsurgical-complications"
https://www.medizininformatik-initiative.de/fhir/ext/modul-onko/CodeSystem/mii-cs-onko-residualstatus,2026.0.1,active,,MII_CS_Onko_Residualstatus,MII CS Onkologie Residualstatus,"oBDS-spezifisches Codesystem für R-Klassifikation","ValueSet/mii-vs-onko-gesamtbeurteilung-residualstatus,ValueSet/mii-vs-onko-beurteilung-lokaler-residualstatus"
https://www.medizininformatik-initiative.de/fhir/ext/modul-onko/CodeSystem/mii-cs-onko-seitenlokalisation,2026.0.1,active,,MII_CS_Onko_Seitenlokalisation,MII CS Onkologie Primärtumor Seitenlokalisation,"Codes für Seitenlokalisation, d.h. organspezifische Angabe der betroffenen Seite.","ValueSet/mii-vs-onko-seitenlokalisation"
https://www.medizininformatik-initiative.de/fhir/ext/modul-onko/CodeSystem/mii-cs-onko-strahlentherapie-applikationsart,2026.0.1,active,,MII_CS_Onko_Strahlentherapie_Applikationsart,MII CS Onkologie Strahlentherapie Applikationsart,"oBDS-spezifisches Codesystem für Klassifikation von Intention der OP","ValueSet/mii-vs-onko-strahlentherapie-applikationsart"
https://www.medizininformatik-initiative.de/fhir/ext/modul-onko/CodeSystem/mii-cs-onko-strahlentherapie-boost,2026.0.1,active,,MII_CS_Onko_Strahlentherapie_Boost,MII CS Onkologie Strahlentherapie Boost,"oBDS-spezifisches Codesystem für Klassifikation von Strahlentherapie-Boosts","ValueSet/mii-vs-onko-strahlentherapie-boost"
https://www.medizininformatik-initiative.de/fhir/ext/modul-onko/CodeSystem/mii-cs-onko-strahlentherapie-strahlenart,2026.0.1,active,,MII_CS_Onko_Strahlentherapie_Strahlenart,MII CS Onkologie Strahlentherapie Strahlenart,"oBDS-spezifisches Codesystem für Klassifikation von eingesetzter Strahlenart","ValueSet/mii-vs-onko-strahlentherapie-strahlenart"
https://www.medizininformatik-initiative.de/fhir/ext/modul-onko/CodeSystem/mii-cs-onko-strahlentherapie-zielgebiet,2026.0.1,active,,MII_CS_Onko_Strahlentherapie_Zielgebiet,MII CS Onkologie Strahlentherapie Zielgebiet,"oBDS-spezifisches Codesystem für Klassifikation von Zielgebiet von Strahlentherapie","ValueSet/mii-vs-onko-strahlentherapie-zielgebiet"
https://www.medizininformatik-initiative.de/fhir/ext/modul-onko/CodeSystem/mii-cs-onko-strahlentherapie-zielgebiet-2014,2026.0.1,active,,MII_CS_Onko_Strahlentherapie_Zielgebiet_2014,MII CS Onkologie Strahlentherapie Zielgebiet oBDS 2014 (Legacy),"oBDS 2014 Legacy-Codesystem für Klassifikation von Zielgebiet von Strahlentherapie - nur für Datenimport und Migration","ValueSet/mii-vs-onko-strahlentherapie-zielgebiet"
https://www.medizininformatik-initiative.de/fhir/ext/modul-onko/CodeSystem/mii-cs-onko-studienteilnahme,2026.0.1,active,,Studienteilnahme,MII CS Onkologie Studienteilnahme,"oBDS-spezifisches Codesystem den Status der Studienteilnahme","ValueSet/mii-vs-onko-studienteilnahme"
https://www.medizininformatik-initiative.de/fhir/ext/modul-onko/CodeSystem/mii-cs-onko-systemische-therapie-protokolle,2026.0.1,active,,MII_CS_Onko_Systemische_Therapie_Protokolle,MII CS Onkologie Systemische Therapie Protokolle,"oBDS-spezifisches Codesystem für Protokolle systemischer Therapien","ValueSet/mii-vs-onko-systemische-therapie-protokolle"
https://www.medizininformatik-initiative.de/fhir/ext/modul-onko/CodeSystem/mii-cs-onko-therapie-ende-grund,2026.0.1,active,,MII_CS_Onko_Therapie_Ende_Grund,MII CS Onkologie Strahlentherapie Ende Grund,"oBDS-spezifisches Codesystem für Klassifikation des Grundes der Beendigung der Strahlentherapie oder der systemischen Therapie","ValueSet/mii-vs-onko-systemische-therapie-ende-grund,ValueSet/mii-vs-onko-strahlentherapie-ende-grund"
https://www.medizininformatik-initiative.de/fhir/ext/modul-onko/CodeSystem/mii-cs-onko-therapie-stellungzurop,2026.0.1,active,,MII_CS_Onko_Therapie_StellungZurOp,MII CS Onkologie Therapie Stellung,"oBDS-spezifisches Codesystem für Klassifikation von Stellung zur OP","ValueSet/mii-vs-onko-strahlentherapie-stellungzurop,ValueSet/mii-vs-onko-systemische-therapie-stellungzurop"
https://www.medizininformatik-initiative.de/fhir/ext/modul-onko/CodeSystem/mii-cs-onko-therapie-typ,2026.0.1,active,,MII_CS_Onko_Therapie_Typ,MII CS Onko Therapie Typ,"Typ der Therapie","ValueSet/mii-vs-onko-systemische-therapie-art,ValueSet/mii-vs-onko-therapieempfehlung-typ"
https://www.medizininformatik-initiative.de/fhir/ext/modul-onko/CodeSystem/mii-cs-onko-therapieabweichung,2026.0.1,active,,MII_CS_Onko_Therapieabweichung,MII CS Onkologie Therapieabweichung,"oBDS-spezifisches Codesystem für die Therapieabweichung auf Wunsch des Patients.","ValueSet/mii-vs-onko-therapieabweichung"
https://www.medizininformatik-initiative.de/fhir/ext/modul-onko/CodeSystem/mii-cs-onko-therapieplanung-typ,2026.0.1,active,,MII_CS_Onko_Therapieplanung_Typ,MII CS Onkologie Therapieplanung Typ,"oBDS-spezifisches Codesystem für den Therapieplanungstyp","ValueSet/mii-vs-onko-therapieplanung-typ"
https://www.medizininformatik-initiative.de/fhir/ext/modul-onko/CodeSystem/mii-cs-onko-tnm-version,2026.0.1,active,,MII_CS_Onko_TNM_Version,MII CS Onkologie TNM Version,"Codes für TNM Version/Auflage nach welcher Version des TNM klassifiziert wird.","ValueSet/mii-vs-onko-tnm-version"
https://www.medizininformatik-initiative.de/fhir/ext/modul-onko/CodeSystem/mii-cs-onko-tod,2026.0.1,active,,MII_CS_Onko_Tod,MII CS Onkologie Tod,"oBDS-spezifisches Codesystem tumorbedingter Tod","ValueSet/mii-vs-onko-tod"
https://www.medizininformatik-initiative.de/fhir/ext/modul-onko/CodeSystem/mii-cs-onko-verlauf-fernmetastasen,2026.0.1,active,,MII_CS_Onko_Verlauf_Fernmetastasen,MII CS Onkologie Verlauf Fernmetastasen,"oBDS-spezifisches Codesystem für die Beurteilung von Fernmetastasen im Behandlungsverlauf","ValueSet/mii-vs-onko-verlauf-fernmetastasen"
https://www.medizininformatik-initiative.de/fhir/ext/modul-onko/CodeSystem/mii-cs-onko-verlauf-gesamtbeurteilung,2026.0.1,active,,MII_CS_Onko_Verlauf_Gesamtbeurteilung,MII CS Onkologie Verlauf Gesamtbeurteilung,"oBDS-spezifisches Codesystem für die Gesamtbeurteilung im Behandlungsverlauf","ValueSet/mii-vs-onko-verlauf-gesamtbeurteilung"
https://www.medizininformatik-initiative.de/fhir/ext/modul-onko/CodeSystem/mii-cs-onko-verlauf-lymphknoten,2026.0.1,active,,MII_CS_Onko_Verlauf_Lymphknoten,MII CS Onkologie Verlauf Lymphknoten,"oBDS-spezifisches Codesystem für die Beurteilung von Lymphknoten im Behandlungsverlauf","ValueSet/mii-vs-onko-verlauf-lymphknoten"
https://www.medizininformatik-initiative.de/fhir/ext/modul-onko/CodeSystem/mii-cs-onko-verlauf-primaertumor,2026.0.1,active,,MII_CS_Onko_Verlauf_Primaertumor,MII CS Onkologie Verlauf Primärtumor,"oBDS-spezifisches Codesystem für die Beurteilung des Primärtumors im Behandlungsverlauf","ValueSet/mii-vs-onko-verlauf-primaertumor"
https://www.medizininformatik-initiative.de/fhir/ext/modul-onko/CodeSystem/mii-cs-onko-weitere-klassifikationen-obds,2026.0.1,active,,MII_CS_Onko_Weitere_Klassifikationen_OBDS,MII CodeSystem Onkologie - Weitere Klassifikationen oBDS,"oBDS-specific classification systems and scoring systems not yet covered by international terminologies (SNOMED CT, NCI Thesaurus). These codes supplement the existing ValueSet for additional classifications. Research required: Check if SNOMED CT or LOINC codes exist for these scoring systems before using oBDS-specific codes.","ValueSet/mii-vs-onko-weitere-klassifikationen-auspraegungen"
https://www.medizininformatik-initiative.de/fhir/ext/modul-seltene/CodeSystem/mii-cs-seltene-empfehlung-status-begruendung,null,active,,MII_CS_Seltene_Empfehlung_StatusBegruendung,MII CS SE Empfehlung Status Begründung,"Begründung bei fehlender Empfehlung","ValueSet/mii-vs-seltene-empfehlung-status-begruendung"
https://www.medizininformatik-initiative.de/fhir/ext/modul-seltene/CodeSystem/mii-cs-seltene-hpo-change-status,2026.0.0,active,,MII_CS_Seltene_HPO_ChangeStatus,MII CS Seltene Erkrankungen HPO Change Status,"CodeSystem zur Dokumentation von Änderungen bei HPO-Phänotypen über Zeit","ValueSet/mii-vs-seltene-symptom-change-status-combined"
https://www.medizininformatik-initiative.de/fhir/ext/modul-seltene/CodeSystem/mii-cs-seltene-narse-therapietyp,2026.0.0,active,,MII_CS_Seltene_NARSE_Therapietyp,MII CS Seltene Erkrankungen NARSE Therapietyp,"CodeSystem für NARSE-spezifische Therapietypen bei Seltenen Erkrankungen","ValueSet/mii-vs-seltene-narse-therapietyp"
https://www.medizininformatik-initiative.de/fhir/ext/modul-seltene/CodeSystem/mii-cs-seltene-therapieempfehlung-strategie,2026.0.0,active,,MII_CS_Seltene_TherapieempfehlungStrategie,MII CS SE Therapieempfehlung Strategie,"Strategietypen für Therapieempfehlungen bei seltenen Erkrankungen, abgeleitet aus MV GenomSeq","ValueSet/mii-vs-seltene-therapieempfehlung-strategie-nicht-medikamentoes,ValueSet/mii-vs-seltene-therapieempfehlung-strategie-medikamentoes"
https://www.medizininformatik-initiative.de/fhir/ext/modul-seltene/CodeSystem/mii-cs-seltene-therapieempfehlung-typ,2026.0.0,active,,MII_CS_Seltene_TherapieempfehlungTyp,MII CS SE Therapieempfehlung Typ,"Therapietyp (kausal vs. symptomatisch) für Therapieempfehlungen bei seltenen Erkrankungen, abgeleitet aus MV GenomSeq","ValueSet/mii-vs-seltene-therapieempfehlung-typ"
https://www.uicc.org/resources/tnm,2026.0.1,active,,MII_CS_Onko_TNM_UICC,MII CS Onkologie TNM UICC,"Codes für TNM UICC Ausprägungen.","ValueSet/mii-vs-onko-tnm-n-kategorie-werte,ValueSet/mii-vs-onko-tnm-cp-praefix,ValueSet/mii-vs-onko-tnm-l-kategorie-werte,ValueSet/mii-vs-onko-tnm-m-symbol,ValueSet/mii-vs-onko-tnm-m-kategorie-werte,ValueSet/mii-vs-onko-tnm-v-kategorie-werte,ValueSet/mii-vs-onko-tnm-s-kategorie-werte,ValueSet/mii-vs-onko-tnm-uicc-stadium,ValueSet/mii-vs-onko-tnm-t-kategorie-werte,ValueSet/mii-vs-onko-tnm-pn-kategorie-werte"
urn:ietf:bcp:47,2.0.1,active,"2.16.840.1.113883.6.121",Ietf3066,Tags for the Identification of Languages,"Older value from OID registry.  Superceded; see recommendations in BCP-47.","ValueSet/languages"
urn:iso-astm:E1762-95:2013,4.0.1,draft,"2.16.840.1.113883.4.642.4.64",SignatureTypeCodes,Signature Type Codes,"The Digital Signature Purposes, an indication of the reason an entity signs a document. This is included in the signed information and can be used when determining accountability for various actions concerning the document. Examples include: author, transcriptionist/recorder, and witness.","ValueSet/88464c5b-5338-4c2b-9c07-b42fef2ada64"
urn:iso:std:iso:11073:10101,20250520,active,"2.16.840.1.113883.6.24",Mdc,ISO/IEEE 11073 Medical Device Communication Nomenclature,"The nomenclature relates primarily to vital signs monitoring, but also includes semantics of other medical devices that are commonly used in acute care settings. There are multiple coding partitions each of which has a systematic name consisting of a set of base concepts and differentiating criteria.","ValueSet/mii-vs-icu-code-observation-beatmung-iso11073,ValueSet/mii-vs-icu-code-observation-bilanzen-iso11073,ValueSet/devicemetric-type,ValueSet/vs-mii-icu-code-monitoring-und-vitaldaten-iso11073"
urn:iso:std:iso:3166,1.0.1,active,"1.0.3166.1",ISO3166Part1,ISO 3166-1 Codes for the representation of names of countries and their subdivisions — Part 1: Country code,"ISO 3166-1 establishes codes that represent the current names of countries, dependencies, and other areas of particular geopolitical interest, on the basis of country names obtained from the United Nations.","ValueSet/jurisdiction,ValueSet/iso3166-1-2"
urn:iso:std:iso:3166-2:de,1.5.4,active,,CodeSystemISO31662DE,ISO-3166-2:de-Laendercodes,"Die Liste der ISO-3166-2:DE Codes für Deutschland enthält die Codes für die deutschen Länder.","ValueSet/ValueSetISO31662DE"
urn:iso:std:iso:3166:-2,1.0.1,active,"1.0.3166.2",ISO3166Part2,ISO 3166-2 Codes for the representation of names of countries and their subdivisions — Part 2: Country subdivision code,"ISO 3166-2 establishes a code that represents the names of the principal administrative divisions, or similar areas, of the countries and entities included in ISO 3166-1.","ValueSet/jurisdiction"
urn:oid:1.2.36.1.2001.1001.101.104.16592,4.0.1,draft,"1.2.36.1.2001.1001.101.104.16592,2.16.840.1.113883.4.642.4.321",PatientMedicineChangeTypes,Patient Medicine Change Types,"Example Item Flags for the List Resource. In this case, these are the kind of flags that would be used on a medication list at the end of a consultation.","ValueSet/list-item-flag"
urn:oid:2.16.840.1.113883.3.1937.777.24.5.3,1.1.0,active,"2.16.840.1.113883.3.1937.777.24.5.3",MII CS Consent Policy,MII Consent: Policy CodeSystem,"Codesystem mit Consent-Policy-Codes zur interoperablen Operationalisierung bzw. Durchsetzung (Enforcement) von Consent Informationen des MII Broad Consent","ValueSet/2.16.840.1.113883.3.1937.777.24.11.36--20230331232804"
