URL,Version,Status,OIDs,Name,Title,Description,Used
http://dicom.nema.org/resources/ontology/DCM,2025.3.20250714,active,"1.2.840.10008.2.16.4",DICOMTerminologyDefinitions,DICOM Controlled Terminology Definitions,"DICOM Code Definitions (Coding Scheme Designator ""DCM"" Coding Scheme Version 2025.3.20250714","ValueSet/security-role-type,ValueSet/dicom-cid-33-Modality"
http://dvmd.de/fhir/CodeSystem/kdl,2025,active,"1.2.276.0.76.5.553",CodeSystemKDL,CodeSystem Klinische Dokumentenklassen-Liste (Version 2025),"Diese CodeSystem-Ressource definiert alle in der Klinischen Dokumentenklassen-Liste aktuell gültigen Codes.","ValueSet/kdl-vs-2025,ValueSet/mii-vs-patho-composition-type-kdl"
http://fdasis.nlm.nih.gov,1.0.0,active,"2.16.840.1.113883.4.9",UNII,Unique Ingredient Identifier (UNII),"A UNII is a non-proprietary, free, unique, unambiguous, nonsemantic, alphanumeric identifier based on a substance's molecular structure and/or descriptive information. UNII identifiers are generated based on scientific identity characteristics using ISO 11238 data elements. UNII availability does not imply any regulatory review or approval. Synonyms and mappings are based on the best public information available at the time of publication.","ValueSet/mii-vs-medikation-unii,ValueSet/mii-vs-onko-systemische-therapie-substanzen-unii"
http://fhir.de/CodeSystem/KontaktDiagnoseProzedur,1.5.4,active,,KontaktDiagnoseProzedur,KontaktDiagnoseProzedur,"Rolle/Relevanz von Diagnosen","ValueSet/DiagnoseTyp,ValueSet/Diagnosesubtyp"
http://fhir.de/CodeSystem/Kontaktebene,1.5.4,active,,Kontaktebene,Kontaktebene,"CodeSystem für die Ebene eines Kontaktes mit einer Gesundheitseinrichtung","ValueSet/kontaktebene-de"
http://fhir.de/CodeSystem/ask,null,active,,Ask,Arzneimittel-Stoffkatalog,"Arzneimittel-Stoffkatalog (ASK) Platzhalter-CodeSystem","ValueSet/mii-vs-medikation-ask"
http://fhir.de/CodeSystem/bfarm/alpha-id,null,active,,AlphaId,Alpha-ID,"Alpha-ID Platzhalter-CodeSystem","ValueSet/mii-vs-diagnose-alphaid"
http://fhir.de/CodeSystem/bfarm/atc,null,active,,Atc,ATC,"ATC Platzhalter-CodeSystem","ValueSet/mii-vs-medikation-atc"
http://fhir.de/CodeSystem/bfarm/icd-10-gm,null,active,,ICD10GM,ICD-10-GM,"ICD-10-GM Platzhalter-CodeSystem","ValueSet/mii-vs-diagnose-icd10gm,ValueSet/valueset-ICD-10-GM"
http://fhir.de/CodeSystem/bfarm/ops,null,active,,OPS,OPS,"OPS Platzhalter-CodeSystem","ValueSet/ops-vs,ValueSet/mii-vs-onko-mamma-operation-ops,ValueSet/mii-vs-onko-ops-strahlentherapie,ValueSet/mii-vs-onko-ops-nuklearmedizin,ValueSet/mii-vs-prozedur-ops"
http://fhir.de/CodeSystem/dgkev/Aufnahmeanlass,1.5.4,active,,CodeSystemAufnahmeanlass,CodeSystemAufnahmeanlass,"Aufnahmeanlass, Datenübermittlung nach § 301 Abs. 3 SGB V","ValueSet/AufnahmeanlassVS"
http://fhir.de/CodeSystem/dkgev/AufnahmegrundDritteStelle,1.5.4,active,,AufnahmegrundDritteStelle,AufnahmegrundDritteStelle,"Aufnahmegrund (3. Stelle), Datenübermittlung nach § 301 Abs. 3 SGB V","ValueSet/AufnahmegrundDritteStelleVS"
http://fhir.de/CodeSystem/dkgev/AufnahmegrundErsteUndZweiteStelle,1.5.4,active,,CodeSystemAufnahmegrundErsteUndZweiteStelle,CodeSystemAufnahmegrundErsteUndZweiteStelle,"Aufnahmegrund (1. und 2. Stelle), Datenübermittlung nach § 301 Abs. 3 SGB V","ValueSet/AufnahmegrundErsteUndZweiteStelleVS"
http://fhir.de/CodeSystem/dkgev/AufnahmegrundVierteStelle,1.5.4,active,,AufnahmegrundVierteStelle,AufnahmegrundVierteStelle,"Aufnahmegrund (4. Stelle), Datenübermittlung nach § 301 Abs. 3 SGB V","ValueSet/AufnahmegrundVierteStelleVS"
http://fhir.de/CodeSystem/dkgev/Fachabteilungsschluessel,1.5.4,active,,CodeSystemFachabteilungsschluessel,Fachabteilungsschluessel,"Fachabteilungen gemäß Anhang 1 der BPflV in der am 31.12.2003 geltenden Fassung","ValueSet/FachabteilungsschluesselVS"
http://fhir.de/CodeSystem/dkgev/Fachabteilungsschluessel-erweitert,1.5.4,active,,CodeSystemFachabteilungsschluesselErweitert,Fachabteilungsschluessel Erweitert,"Fachabteilungen gemäß Anhang 1 der BPflV in der am 31.12.2003 geltenden Fassung inkl. Spezialisierungen","ValueSet/FachabteilungsschluesselErweitert"
http://fhir.de/CodeSystem/identifier-type-de-basis,1.5.4,active,,IdentifierTypeDeBasis,Identifier Type De Basis,"Liste der Identfikatorentypen des deutschen Basisprofils welche die Standardtypen ergänzen.","ValueSet/identifier-type-de-basis"
http://fhir.de/CodeSystem/kontaktart-de,1.5.4,active,,KontaktArtDe,KontaktArtDe,"Klassifizierung eines Kontaktes mit einer Gesundheitseinrichtung","ValueSet/kontaktart-de"
http://hl7.org/fhir/CodeSystem/medication-statement-status,4.0.1,draft,"2.16.840.1.113883.4.642.4.1379",Medication Status Codes,Medication  status  codes,"Medication Status Codes","ValueSet/medication-statement-status"
http://hl7.org/fhir/CodeSystem/medication-status,4.0.1,draft,"2.16.840.1.113883.4.642.4.1380",Medication Status Codes,Medication  status  codes,"Medication Status Codes","ValueSet/medication-status"
http://hl7.org/fhir/CodeSystem/medicationrequest-intent,4.0.1,draft,"2.16.840.1.113883.4.642.4.1378",medicationRequest Intent,Medication request  intent,"MedicationRequest Intent Codes","ValueSet/medicationrequest-intent"
http://hl7.org/fhir/CodeSystem/medicationrequest-status,4.0.1,draft,"2.16.840.1.113883.4.642.4.1377",medicationrequest Status,Medicationrequest  status,"MedicationRequest Status Codes","ValueSet/medicationrequest-status"
http://hl7.org/fhir/action-cardinality-behavior,4.0.1,draft,"2.16.840.1.113883.4.642.4.808",ActionCardinalityBehavior,ActionCardinalityBehavior,"Defines behavior for an action or a group for how many times that item may be repeated.","ValueSet/action-cardinality-behavior"
http://hl7.org/fhir/action-condition-kind,4.0.1,draft,"2.16.840.1.113883.4.642.4.816",ActionConditionKind,ActionConditionKind,"Defines the kinds of conditions that can appear on actions.","ValueSet/action-condition-kind"
http://hl7.org/fhir/action-grouping-behavior,4.0.1,draft,"2.16.840.1.113883.4.642.4.800",ActionGroupingBehavior,ActionGroupingBehavior,"Defines organization behavior of a group.","ValueSet/action-grouping-behavior"
http://hl7.org/fhir/action-precheck-behavior,4.0.1,draft,"2.16.840.1.113883.4.642.4.806",ActionPrecheckBehavior,ActionPrecheckBehavior,"Defines selection frequency behavior for an action or group.","ValueSet/action-precheck-behavior"
http://hl7.org/fhir/action-relationship-type,4.0.1,draft,"2.16.840.1.113883.4.642.4.814",ActionRelationshipType,ActionRelationshipType,"Defines the types of relationships between actions.","ValueSet/action-relationship-type"
http://hl7.org/fhir/action-required-behavior,4.0.1,draft,"2.16.840.1.113883.4.642.4.804",ActionRequiredBehavior,ActionRequiredBehavior,"Defines expectations around whether an action or action group is required.","ValueSet/action-required-behavior"
http://hl7.org/fhir/action-selection-behavior,4.0.1,draft,"2.16.840.1.113883.4.642.4.802",ActionSelectionBehavior,ActionSelectionBehavior,"Defines selection behavior of a group.","ValueSet/action-selection-behavior"
http://hl7.org/fhir/address-type,4.0.1,active,"2.16.840.1.113883.4.642.4.70",AddressType,AddressType,"The type of an address (physical / postal).","ValueSet/address-type"
http://hl7.org/fhir/address-use,4.0.1,active,"2.16.840.1.113883.4.642.4.68",AddressUse,AddressUse,"The use of an address.","ValueSet/address-use"
http://hl7.org/fhir/administrative-gender,4.0.1,active,"2.16.840.1.113883.4.642.4.2",AdministrativeGender,AdministrativeGender,"The gender of a person used for administrative purposes.","ValueSet/administrative-gender"
http://hl7.org/fhir/adverse-event-actuality,4.0.1,draft,"2.16.840.1.113883.4.642.4.832",AdverseEventActuality,AdverseEventActuality,"Overall nature of the adverse event, e.g. real or potential.","ValueSet/adverse-event-actuality"
http://hl7.org/fhir/bundle-type,4.0.1,active,"2.16.840.1.113883.4.642.4.621",BundleType,BundleType,"Indicates the purpose of a bundle - how it is intended to be used.","ValueSet/bundle-type"
http://hl7.org/fhir/care-plan-activity-status,4.0.1,draft,"2.16.840.1.113883.4.642.4.147",CarePlanActivityStatus,CarePlanActivityStatus,"Codes that reflect the current state of a care plan activity within its overall life cycle.","ValueSet/care-plan-activity-status"
http://hl7.org/fhir/composition-attestation-mode,4.0.1,draft,"2.16.840.1.113883.4.642.4.239",CompositionAttestationMode,CompositionAttestationMode,"The way in which a person authenticated a composition.","ValueSet/composition-attestation-mode"
http://hl7.org/fhir/composition-status,4.0.1,draft,"2.16.840.1.113883.4.642.4.242",CompositionStatus,CompositionStatus,"The workflow/clinical status of the composition.","ValueSet/composition-status"
http://hl7.org/fhir/consent-data-meaning,4.0.1,draft,"2.16.840.1.113883.4.642.4.760",ConsentDataMeaning,ConsentDataMeaning,"How a resource reference is interpreted when testing consent restrictions.","ValueSet/consent-data-meaning"
http://hl7.org/fhir/consent-provision-type,4.0.1,draft,"2.16.840.1.113883.4.642.4.758",ConsentProvisionType,ConsentProvisionType,"How a rule statement is applied, such as adding additional consent or removing consent.","ValueSet/consent-provision-type"
http://hl7.org/fhir/consent-state-codes,4.0.1,draft,"2.16.840.1.113883.4.642.4.756",ConsentState,ConsentState,"Indicates the state of the consent.","ValueSet/consent-state-codes"
http://hl7.org/fhir/days-of-week,4.0.1,active,"2.16.840.1.113883.4.642.4.513",DaysOfWeek,DaysOfWeek,"The days of the week.","ValueSet/days-of-week"
http://hl7.org/fhir/device-nametype,4.0.1,draft,"2.16.840.1.113883.4.642.4.1084",DeviceNameType,DeviceNameType,"The type of name the device is referred by.","ValueSet/device-nametype"
http://hl7.org/fhir/device-status,4.0.1,draft,"2.16.840.1.113883.4.642.4.210",FHIRDeviceStatus,FHIRDeviceStatus,"The availability status of the device.","ValueSet/device-status"
http://hl7.org/fhir/diagnostic-report-status,4.0.1,draft,"2.16.840.1.113883.4.642.4.236",DiagnosticReportStatus,DiagnosticReportStatus,"The status of the diagnostic report.","ValueSet/diagnostic-report-status"
http://hl7.org/fhir/document-reference-status,4.0.1,draft,"2.16.840.1.113883.4.642.4.8",DocumentReferenceStatus,DocumentReferenceStatus,"The status of the document reference.","ValueSet/document-reference-status"
http://hl7.org/fhir/document-relationship-type,4.0.1,draft,"2.16.840.1.113883.4.642.4.245",DocumentRelationshipType,DocumentRelationshipType,"The type of relationship between documents.","ValueSet/document-relationship-type"
http://hl7.org/fhir/encounter-location-status,4.0.1,draft,"2.16.840.1.113883.4.642.4.263",EncounterLocationStatus,EncounterLocationStatus,"The status of the location.","ValueSet/encounter-location-status"
http://hl7.org/fhir/encounter-status,4.0.1,draft,"2.16.840.1.113883.4.642.4.247",EncounterStatus,EncounterStatus,"Current state of the encounter.","ValueSet/EncounterStatusDe,ValueSet/encounter-status"
http://hl7.org/fhir/event-status,4.0.1,draft,"2.16.840.1.113883.4.642.4.110",EventStatus,EventStatus,"Codes identifying the lifecycle stage of an event.","ValueSet/event-status,ValueSet/clinicalimpression-status"
http://hl7.org/fhir/event-timing,4.0.1,active,"2.16.840.1.113883.4.642.4.76",EventTiming,EventTiming,"Real world event relating to the schedule.","ValueSet/event-timing"
http://hl7.org/fhir/group-measure,4.0.1,draft,"2.16.840.1.113883.4.642.4.1346",GroupMeasure,GroupMeasure,"Possible group measure aggregates (E.g. Mean, Median).","ValueSet/group-measure"
http://hl7.org/fhir/history-status,4.0.1,draft,"2.16.840.1.113883.4.642.4.268",FamilyHistoryStatus,FamilyHistoryStatus,"A code that identifies the status of the family history record.","ValueSet/history-status"
http://hl7.org/fhir/http-verb,4.0.1,active,"2.16.840.1.113883.4.642.4.625",HTTPVerb,HTTPVerb,"HTTP verbs (in the HTTP command line). See [HTTP rfc](https://tools.ietf.org/html/rfc7231) for details.","ValueSet/http-verb"
http://hl7.org/fhir/identifier-use,4.0.1,active,"2.16.840.1.113883.4.642.4.58",IdentifierUse,IdentifierUse,"Identifies the purpose for this identifier, if known .","ValueSet/identifier-use"
http://hl7.org/fhir/imagingstudy-status,4.0.1,draft,"2.16.840.1.113883.4.642.4.991",ImagingStudyStatus,ImagingStudyStatus,"The status of the ImagingStudy.","ValueSet/imagingstudy-status"
http://hl7.org/fhir/link-type,4.0.1,active,"2.16.840.1.113883.4.642.4.424",LinkType,LinkType,"The type of link between this patient resource and another patient resource.","ValueSet/link-type"
http://hl7.org/fhir/list-mode,4.0.1,draft,"2.16.840.1.113883.4.642.4.319",ListMode,ListMode,"The processing mode that applies to this list.","ValueSet/list-mode"
http://hl7.org/fhir/list-status,4.0.1,draft,"2.16.840.1.113883.4.642.4.327",ListStatus,ListStatus,"The current state of the list.","ValueSet/list-status"
http://hl7.org/fhir/metric-calibration-state,4.0.1,draft,"2.16.840.1.113883.4.642.4.653",DeviceMetricCalibrationState,DeviceMetricCalibrationState,"Describes the state of a metric calibration.","ValueSet/metric-calibration-state"
http://hl7.org/fhir/metric-calibration-type,4.0.1,draft,"2.16.840.1.113883.4.642.4.651",DeviceMetricCalibrationType,DeviceMetricCalibrationType,"Describes the type of a metric calibration.","ValueSet/metric-calibration-type"
http://hl7.org/fhir/metric-category,4.0.1,draft,"2.16.840.1.113883.4.642.4.649",DeviceMetricCategory,DeviceMetricCategory,"Describes the category of the metric.","ValueSet/metric-category"
http://hl7.org/fhir/metric-color,4.0.1,draft,"2.16.840.1.113883.4.642.4.655",DeviceMetricColor,DeviceMetricColor,"Describes the typical color of representation.","ValueSet/metric-color"
http://hl7.org/fhir/metric-operational-status,4.0.1,draft,"2.16.840.1.113883.4.642.4.647",DeviceMetricOperationalStatus,DeviceMetricOperationalStatus,"Describes the operational status of the DeviceMetric.","ValueSet/metric-operational-status"
http://hl7.org/fhir/name-use,4.0.1,active,"2.16.840.1.113883.4.642.4.66",NameUse,NameUse,"The use of a human name.","ValueSet/name-use"
http://hl7.org/fhir/narrative-status,4.0.1,draft,"2.16.840.1.113883.4.642.4.56",NarrativeStatus,NarrativeStatus,"The status of a resource narrative.","ValueSet/narrative-status"
http://hl7.org/fhir/observation-status,4.0.1,active,"2.16.840.1.113883.4.642.4.401",ObservationStatus,ObservationStatus,"Codes providing the status of an observation.","ValueSet/observation-status"
http://hl7.org/fhir/provenance-entity-role,4.0.1,draft,"2.16.840.1.113883.4.642.4.437",ProvenanceEntityRole,ProvenanceEntityRole,"How an entity was used in an activity.","ValueSet/provenance-entity-role"
http://hl7.org/fhir/publication-status,4.0.1,active,"2.16.840.1.113883.4.642.4.4",PublicationStatus,PublicationStatus,"The lifecycle status of an artifact.","ValueSet/publication-status"
http://hl7.org/fhir/quantity-comparator,4.0.1,active,"2.16.840.1.113883.4.642.4.60",QuantityComparator,QuantityComparator,"How the Quantity should be understood and represented.","ValueSet/quantity-comparator"
http://hl7.org/fhir/related-artifact-type,4.0.1,draft,"2.16.840.1.113883.4.642.4.100",RelatedArtifactType,RelatedArtifactType,"The type of relationship to the related artifact.","ValueSet/related-artifact-type"
http://hl7.org/fhir/request-intent,4.0.1,draft,"2.16.840.1.113883.4.642.4.114",RequestIntent,RequestIntent,"Codes indicating the degree of authority/intentionality associated with a request.","ValueSet/request-intent,ValueSet/task-intent,ValueSet/care-plan-intent"
http://hl7.org/fhir/request-priority,4.0.1,draft,"2.16.840.1.113883.4.642.4.116",RequestPriority,RequestPriority,"Identifies the level of importance to be assigned to actioning the request.","ValueSet/request-priority"
http://hl7.org/fhir/request-status,4.0.1,draft,"2.16.840.1.113883.4.642.4.112",RequestStatus,RequestStatus,"Codes identifying the lifecycle stage of a request.","ValueSet/request-status"
http://hl7.org/fhir/research-study-status,4.0.1,draft,"2.16.840.1.113883.4.642.4.820",ResearchStudyStatus,ResearchStudyStatus,"Codes that convey the current status of the research study.","ValueSet/research-study-status"
http://hl7.org/fhir/research-subject-status,4.0.1,draft,"2.16.840.1.113883.4.642.4.830",ResearchSubjectStatus,ResearchSubjectStatus,"Indicates the progression of a study subject through a study.","ValueSet/research-subject-status"
http://hl7.org/fhir/resource-types,4.0.1,active,,ResourceType,ResourceType,"One of the resource types defined as part of this version of FHIR.","ValueSet/subject-type,ValueSet/consent-content-class,ValueSet/resource-types,ValueSet/care-plan-activity-kind"
http://hl7.org/fhir/search-entry-mode,4.0.1,active,"2.16.840.1.113883.4.642.4.623",SearchEntryMode,SearchEntryMode,"Why an entry is in the result set - whether it's included as a match or because of an _include requirement, or to convey information or warning information about the search process.","ValueSet/search-entry-mode"
http://hl7.org/fhir/sid/icd-10,2.1.1,retired,"2.16.840.1.113883.6.3",Icd10,ICD-10,"International Classification of Diseases revision 10 (ICD 10)","ValueSet/mii-vs-person-icd10who"
http://hl7.org/fhir/specimen-status,4.0.1,draft,"2.16.840.1.113883.4.642.4.472",SpecimenStatus,SpecimenStatus,"Codes providing the status/availability of a specimen.","ValueSet/specimen-status"
http://hl7.org/fhir/substance-status,4.0.1,draft,"2.16.840.1.113883.4.642.4.475",FHIRSubstanceStatus,FHIRSubstanceStatus,"A code to indicate if the substance is actively used.","ValueSet/substance-status"
http://hl7.org/fhir/task-intent,4.0.1,draft,"2.16.840.1.113883.4.642.4.1241",TaskIntent,TaskIntent,"Distinguishes whether the task is a proposal, plan or full order.","ValueSet/task-intent"
http://hl7.org/fhir/task-status,4.0.1,draft,"2.16.840.1.113883.4.642.4.791",TaskStatus,TaskStatus,"The current status of the task.","ValueSet/task-status"
http://hl7.org/fhir/udi-entry-type,4.0.1,draft,"2.16.840.1.113883.4.642.4.212",UDIEntryType,UDIEntryType,"Codes to identify how UDI data was entered.","ValueSet/udi-entry-type"
http://hl7.org/fhir/uv/genomics-reporting/CodeSystem/clinvar-evidence-level-custom-cs,3.0.0,active,,ClinVarEvidenceLevelCustomCS,ClinVar Evidence Level Example Codes,"ClinVar contains examples of evidence level concepts that are not conflated with clinical significance. These can be found on  ClinVar https://www.ncbi.nlm.nih.gov/clinvar/docs/review_status/ . These examples are informational only, for copyright information contact the relevant source.","ValueSet/evidence-level-example-vs"
http://hl7.org/fhir/uv/genomics-reporting/CodeSystem/genomic-study-type-cs,3.0.0,active,,GenomicStudyTypeCS,Genomic Study Type CodeSystem,"Backport of http://hl7.org/fhir/genomicstudy-type","ValueSet/genomic-study-type-vs"
http://hl7.org/fhir/uv/genomics-reporting/CodeSystem/molecular-biomarker-ontology-cs,3.0.0,active,,MolecularBiomarkerOntologyCS,Molecular Biomarker Ontology Codes,"This (experimental) code system provides for a draft categorization of biomarkers along several axes. Based on ballot feedback, the committee anticipates significant revisions.","ValueSet/molecular-biomarker-category-vs"
http://hl7.org/fhir/uv/genomics-reporting/CodeSystem/pharmgkb-evidence-level-custom-cs,3.0.0,active,,PharmGKBEvidenceLevelCustomCS,PharmGKB Evidence Level Example Codes,"PharmGKB contains examples of evidence level concepts that are not conflated with clinical significance. These can be found on PharmGKB https://www.pharmgkb.org/page/clinAnnLevels. These examples are informational only, for copyright information contact the relevant source.","ValueSet/evidence-level-example-vs"
http://hl7.org/fhir/variable-type,4.0.1,draft,"2.16.840.1.113883.4.642.4.1344",EvidenceVariableType,EvidenceVariableType,"The possible types of variables for exposures or outcomes (E.g. Dichotomous, Continuous, Descriptive).","ValueSet/variable-type"
http://human-phenotype-ontology.org,1.0.0,active,"2.16.840.1.113883.6.339",HPO,Human Phenotype Ontology,"""The Human Phenotype Ontology (HPO) provides a standardized vocabulary of phenotypic abnormalities encountered in human disease. Each term in the HPO describes a phenotypic abnormality, such as Atrial septal defect. The HPO is currently being developed using the medical literature, Orphanet, DECIPHER, and OMIM. HPO currently contains over 13,000 terms and over 156,000 annotations to hereditary diseases. The HPO project and others have developed software for phenotype-driven differential diagnostics, genomic diagnostics, and translational research. The HPO is a flagship product of the Monarch Initiative, an NIH-supported international consortium dedicated to semantic integration of biomedical and model organism data with the ultimate goal of improving biomedical research. The HPO, as a part of the Monarch Initiative, is a central component of one of the 13 driver projects in the Global Alliance for Genomics and Health (GA4GH) strategic roadmap.""    Please see https://hpo.jax.org/app/download/ontology.    Releases, produced approximately every 2 months, can be found [here](https://github.com/obophenotype/human-phenotype-ontology/releases).","ValueSet/condition-inheritance-mode-vs,ValueSet/mii-vs-seltene-hpo-severity,ValueSet/mii-vs-seltene-hpo-phenotypic-observation-codes"
http://ihe-d.de/CodeSystems/DokumentenWarnhinweise,2021-07-06T21:19:41,active,,DokumentenWarnhinweise,Dokumenten Warnhinweise,"","ValueSet/1.2.276.0.76.11.34--20210706211941"
http://ihe-d.de/CodeSystems/FallkontextBeiDokumentenerstellung,2021-07-06T21:19:41,active,,FallkontextBeiDokumentenerstellung,Fallkontext Bei Dokumentenerstellung,"","ValueSet/mii-vs-medikation-fallkontext,ValueSet/1.2.276.0.76.11.34--20210706211941"
http://ihe-d.de/CodeSystems/IHEXDSclassCode,2021-06-25T13:44:47,active,,IHEXDSclassCode, IHEXDSclassCode,"","ValueSet/1.2.276.0.76.11.32--20210625134447"
http://ihe-d.de/CodeSystems/IHEXDStypeCode,2020-02-07T07:55:58,active,,IHEXDStypeCode,IHEXDStypeCode,"","ValueSet/1.2.276.0.76.11.38--20200207075558"
http://ihe.net/fhir/ihe.formatcode.fhir/CodeSystem/formatcode,1.4.0,active,"1.3.6.1.4.1.19376.1.2.3",IHE_FormatCode_codesystem,IHE Format Code set for use with Document Sharing,"The [IHE](http://www.ihe.net) FormatCode code system with canonical URI of http://ihe.net/fhir/ihe.formatcode.fhir/CodeSystem/formatcode is defined to be the set of FormatCodes define by IHE, for use with [Document Sharing](https://profiles.ihe.net/ITI/HIE-Whitepaper/index.html). This code set additionally includes, as deprecated, format codes defined by [HL7 for some Implementation Guides](http://wiki.hl7.org/index.php?title=CDA_Format_Codes_for_IHE_XDS). The HL7 codes are now managed by HL7. The set of IHE FormatCode codes was listed in HITSP C80 Table 2-153 Format Code Value Set Definition, but since has been updated. The use of the FormatCode specifies the technical format of the document. The FormatCode tends to reference the IHE Content Profile (Implementation Guide) that defines the use-case and constraints. The FormatCode is a further specialization more detailed than the mime-type. The FormatCode provides sufficient metadata information to allow any potential document content consumer to know if it can process and/or display by identifying a document encoding, structure and template. The set of codes is intended to be preferred.","ValueSet/1.2.276.0.76.11.34--20210706211941"
http://loinc.org,3.1.0,active,"2.16.840.1.113883.6.1",LOINC,Logical Observation Identifiers, Names and Codes (LOINC),"LOINC provides a set of universal names and ID codes for identifying laboratory and clinical test results.1,2 LOINC facilitates the exchange and pooling of results, such as blood hemoglobin, serum potassium, or vital signs, for clinical care, outcomes management, and research. LOINC's universal identifiers (names and codes) can be used in the context of order and observation exchanges between information systems that use syntax standards such as HL73, CEN TC251, ISO TC215, ASTM4, and DICOM. Specifically, the identifier can be used as the coded value for an observation in any other standard that uses the observation/observation value paradigm, whether messages, documents, application programming interface (API), etc. For example, LOINC codes are used widely in the OBX segment Observation Identifier field (OBX-3) of an ORU HL7 (HL7 version 2.x or ASTM 1238-9410) message that may be sent between a Clinical Laboratory Information Management Systems (LIMS) and Electronic Health Record Systems (EHR).5, 6 In this way, LOINC codes provide universal identifiers that allow the exchange of clinical data between heterogeneous computing environments.","ValueSet/mii-vs-onko-krk-abstand-circumferelle-resektionsrand,ValueSet/mii-vs-patho-service-request-code,ValueSet/mii-vs-onko-mamma-rezeptorstatus-obds,ValueSet/mii-vs-bildgebung-diagnostic-report-code-lnc,ValueSet/document-classcodes,ValueSet/mii-vs-onko-melanom-ldh,ValueSet/doc-typecodes,ValueSet/1.2.276.0.76.11.38--20200207075558,ValueSet/report-codes,ValueSet/observation-codes,ValueSet/mii-vs-patho-all-loinc,ValueSet/mii-vs-seltene-hpo-presence-status,ValueSet/mii-vs-onko-prostata-psa-loinc,ValueSet/molecular-biomarker-code-vs,ValueSet/consent-category,ValueSet/vs-mii-icu-code-monitoring-und-vitaldaten-loinc,ValueSet/c80-doc-typecodes,ValueSet/1.2.276.0.76.11.32--20210625134447,ValueSet/consent-content-code,ValueSet/doc-section-codes,ValueSet/mii-vs-labor-order-codes,ValueSet/mii-vs-icu-code-observation-beatmung-loinc,ValueSet/mii-vs-seltene-blutgruppe,ValueSet/mii-vs-patho-section-types-loinc,ValueSet/null,ValueSet/mii-vs-onko-krk-abstand-resektionslinie-aboral,ValueSet/mii-vs-icu-code-observation-extrakorporale-verfahren-loinc,ValueSet/mii-vs-icu-code-observation-bilanzen-loinc,ValueSet/genetic-therapeutic-implications-vs"
