URL,Version,Status,OIDs,Name,Title,Description,Used
http://terminology.hl7.org/CodeSystem/v3-ActCode,9.0.0,active,"2.16.840.1.113883.5.4",ActCode,ActCode,"A code specifying the particular kind of Act that the Act-instance represents within its class.    *Constraints:* The kind of Act (e.g. physical examination, serum potassium, inpatient encounter, charge financial transaction, etc.) is specified with a code from one of several, typically external, coding systems. The coding system will depend on the class of Act, such as LOINC for observations, etc.    Conceptually, the Act.code must be a specialization of the Act.classCode. This is why the structure of ActClass domain should be reflected in the superstructure of the ActCode domain and then individual codes or externally referenced vocabularies subordinated under these domains that reflect the ActClass structure.    Act.classCode and Act.code are not modifiers of each other but the Act.code concept should really imply the Act.classCode concept. For a negative example, it is not appropriate to use an Act.code ""potassium"" together with and Act.classCode for ""laboratory observation"" to somehow mean ""potassium laboratory observation"" and then use the same Act.code for ""potassium"" together with Act.classCode for ""medication"" to mean ""substitution of potassium"". This mutually modifying use of Act.code and Act.classCode is not permitted.","ValueSet/v3-ActCode,ValueSet/EncounterClassDE,ValueSet/provenance-activity-type,ValueSet/v3-ActEncounterCode"
http://terminology.hl7.org/CodeSystem/v3-ActPriority,3.0.0,active,"2.16.840.1.113883.5.7",ActPriority,ActPriority,"A set of codes (e.g., for routine, emergency), specifying the urgency under which the Act happened, can happen, is happening, is intended to happen, or is requested/demanded to happen.","ValueSet/v3-ActPriority"
http://terminology.hl7.org/CodeSystem/v3-ActReason,3.1.0,active,"2.16.840.1.113883.5.8",ActReason,ActReason,"A set of codes specifying the motivation, cause, or rationale of an Act, when such rationale is not reasonably represented as an ActRelationship of type ""has reason"" linking to another Act.    *Examples:* Example reasons that might qualify for being coded in this field might be: ""routine requirement"", ""infectious disease reporting requirement"", ""on patient request"", ""required by law"".","ValueSet/v3-PurposeOfUse,ValueSet/v3-SubstanceAdminSubstitutionReason"
http://terminology.hl7.org/CodeSystem/v3-Confidentiality,3.0.0,active,"2.16.840.1.113883.5.25",Confidentiality,Confidentiality,"A set of codes specifying the security classification of acts and roles in accordance with the definition for concept domain ""Confidentiality"".","ValueSet/v3-ConfidentialityClassification"
http://terminology.hl7.org/CodeSystem/v3-DataOperation,5.0.0,active,"2.16.840.1.113883.5.1123",DataOperation,DataOperation,"**** MISSING DESCRIPTION ****","ValueSet/provenance-activity-type"
http://terminology.hl7.org/CodeSystem/v3-DocumentCompletion,3.0.0,active,"2.16.840.1.113883.5.33",DocumentCompletion,DocumentCompletion,"Identifies the current completion state of a clinical document.","ValueSet/provenance-activity-type"
http://terminology.hl7.org/CodeSystem/v3-EncounterSpecialCourtesy,3.0.0,active,"2.16.840.1.113883.5.40",EncounterSpecialCourtesy,EncounterSpecialCourtesy,"**** MISSING DESCRIPTION ****","ValueSet/encounter-special-courtesy"
http://terminology.hl7.org/CodeSystem/v3-GTSAbbreviation,3.0.0,active,"2.16.840.1.113883.5.1022",GTSAbbreviation,GTSAbbreviation,"*Open Issue:* It appears that the printnames are suboptimal and should be improved for many of the existing codes.","ValueSet/timing-abbreviation"
http://terminology.hl7.org/CodeSystem/v3-MaritalStatus,3.0.0,active,"2.16.840.1.113883.5.2",MaritalStatus,MaritalStatus,"\* \* \* No description supplied \* \* \*    *Open Issue:* The specific meanings of these codes can vary somewhat by jurisdiction and implementation so caution should be used when determining equivalency.    *Open Issue:* fixing and completion of the hierarchy and proper good definitions of all the concepts is badly needed.","ValueSet/marital-status"
http://terminology.hl7.org/CodeSystem/v3-NullFlavor,3.0.0,active,"2.16.840.1.113883.5.1008",NullFlavor,NullFlavor,"A collection of codes specifying why a valid value is not present.","ValueSet/marital-status,ValueSet/encounter-special-courtesy"
http://terminology.hl7.org/CodeSystem/v3-ObservationInterpretation,3.0.0,active,"2.16.840.1.113883.5.83",ObservationInterpretation,ObservationInterpretation,"One or more codes providing a rough qualitative interpretation of the observation, such as ""normal"" / ""abnormal"", ""low"" / ""high"", ""better"" / ""worse"", ""resistant"" / ""susceptible"", ""expected"" / ""not expected"". The value set is intended to be for ANY use where coded representation of an interpretation is needed.","ValueSet/observation-interpretation"
http://terminology.hl7.org/CodeSystem/v3-ParticipationFunction,3.0.0,active,"2.16.840.1.113883.5.88",ParticipationFunction,ParticipationFunction,"This code is used to specify the exact function an actor had in a service in all necessary detail. This domain may include local extensions (CWE).","ValueSet/security-role-type"
http://terminology.hl7.org/CodeSystem/v3-ParticipationType,5.0.0,active,"2.16.840.1.113883.5.90",ParticipationType,ParticipationType,"A code specifying the meaning and purpose of every Participation instance. Each of its values implies specific constraints on the Roles undertaking the participation.","ValueSet/series-performer-function,ValueSet/security-role-type,ValueSet/encounter-participant-type,ValueSet/provenance-activity-type"
http://terminology.hl7.org/CodeSystem/v3-RoleClass,4.0.0,active,"2.16.840.1.113883.5.110",RoleClass,RoleClass,"Codes for the Role class hierarchy. The values in this hierarchy, represent a Role which is an association or relationship between two entities - the entity that plays the role and the entity that scopes the role. Roles names are derived from the name of the playing entity in that role.    The role hierarchy stems from three core concepts, or abstract domains:     *  **RoleClassOntological** is an abstract domain that collects roles in which the playing entity is defined or specified by the scoping entity.   *  **RoleClassPartitive** collects roles in which the playing entity is in some sense a ""part"" of the scoping entity.   *  **RoleClassAssociative** collects all of the remaining forms of association between the playing entity and the scoping entity. This set of roles is further partitioned between:             *  **RoleClassPassive** which are roles in which the playing entity is used, known, treated, handled, built, or destroyed, etc. under the auspices of the scoping entity. The playing entity is passive in these roles in that the role exists without an agreement from the playing entity.       *  **RoleClassMutualRelationship** which are relationships based on mutual behavior of the two entities. The basis of these relationship may be formal agreements or they may be *de facto* behavior. Thus, this sub-domain is further divided into:                     *  **RoleClassRelationshipFormal** in which the relationship is formally defined, frequently by a contract or agreement.           *  **Personal relationship** which inks two people in a personal relationship.    The hierarchy discussed above is represented In the current vocabulary tables as a set of abstract domains, with the exception of the ""Personal relationship"" which is a leaf concept.    *OpenIssue:* Description copied from Concept Domain of same name. Must be verified.","ValueSet/security-role-type"
http://terminology.hl7.org/CodeSystem/v3-RoleCode,3.0.0,active,"2.16.840.1.113883.5.111",RoleCode,RoleCode,"A set of codes further specifying the kind of Role; specific classification codes for further qualifying RoleClass codes.","ValueSet/v3-PersonalRelationshipRoleType,ValueSet/security-role-type,ValueSet/v3-FamilyMember,ValueSet/v3-ServiceDeliveryLocationRoleType"
http://terminology.hl7.org/CodeSystem/v3-TimingEvent,3.0.0,active,"2.16.840.1.113883.5.139",TimingEvent,TimingEvent,"**** MISSING DESCRIPTION ****","ValueSet/event-timing"
http://terminology.hl7.org/CodeSystem/v3-substanceAdminSubstitution,3.0.0,active,"2.16.840.1.113883.5.1070",SubstanceAdminSubstitution,Substance Admin Substitution,"Identifies what sort of change is permitted or has occurred between the therapy that was ordered and the therapy that was/will be provided.","ValueSet/v3-ActSubstanceAdminSubstitutionCode"
http://terminology.hl7.org/CodeSystem/variant-confidence-status-cs,3.0.0,active,,VariantConfidenceStatusCS,Variant Confidence Status Codes,"A code that represents the confidence of a true positive variant call.","ValueSet/variant-confidence-status-vs"
http://unitsofmeasure.org,3.0.1,active,"2.16.840.1.113883.6.8",UCUM,Unified Code for Units of Measure (UCUM),"The Unified Code for Units of Measure (UCUM) is a code system intended to include all units of measures being contemporarily used in international science, engineering, and business. The purpose is to facilitate unambiguous electronic communication of quantities together with their units. The focus is on electronic communication, as opposed to communication between humans. A typical application of The Unified Code for Units of Measure are electronic data interchange (EDI) protocols, but there is nothing that prevents it from being used in other types of machine communication.","ValueSet/VitalSignDE-Body-Weigth-UCUM,ValueSet/mii-vs-icu-unit-equivalent-ucum-breaths-per-minute,ValueSet/mii-vs-icu-unit-equivalent-ucum-milliliter,ValueSet/mii-vs-biobank-dna-concentration-units-ucum,ValueSet/DosageDoseQuantityDE,ValueSet/UcumVitalsCommonDE,ValueSet/mii-vs-icu-unit-equivalent-ucum-beats-per-minute,ValueSet/units-of-time,ValueSet/mii-vs-onko-strahlentherapie-strahlungseinheit,ValueSet/VitalSignDE-Body-Length-UCUM"
http://varnomen.hgvs.org,2.0.1,active,"2.16.840.1.113883.6.282",Hgvs,Human Genome Variation Society nomenclature,"HGVS nomenclatures are the guidelines for mutation nomenclature made by the Human Genome Variation Society.    HGVS nomenclature can be used with the HL7 coded data type (code data type that accepts expression data, or a coded expression data type). This coded data type should be able to distinguish expressions in HGVS nomenclature from coded concepts. For example, in the HL7 messages specified according to the HL7 V2 Clinical Genomics Fully LOINC-Qualified Genetic Variation Model, HGVS nomenclature can be used to as the observation values for DNA sequence variations. For example, OBX|1|CWE|48004-6^DNA Sequence Variation^LN||c.1129C>T^^HGVS|    Versioning information: The HGVS nomenclature for the description of sequence variants was last modified Feb 20, 2008. The HGVS nomenclature for the description of protein sequence variants was last modified May 12, 2007. The HGVS nomenclature for the description of DNA sequence variants was last modified June 15, 2007 The HGVS nomenclature for the description of RNA sequence variants was last modified May 12, 2007    HGVS nomenclatures can be used freely by the public.","ValueSet/hgvs-vs"
http://www.genenames.org,3.1.0,active,"2.16.840.1.113883.6.281",HGNCGenes,HUGO Gene Nomenclature Committee Genes,"""The HGNC is responsible for approving unique symbols and names for human loci, including protein coding genes, ncRNA genes and pseudogenes, to allow unambiguous scientific communication.""    The HGNC gene table carries gene IDs, gene symbols and full gene names. Guidance from HGNC confirms that gene symbols are not unique across species and have been known to change in some instances. Thus the commonly used gene symbols should be encoded in FHIR as ""displays"" with the corresponding IDs (beginning with ""HGNC:"") as the ""codes"".    ""For each known human gene we approve a gene name and symbol (short-form abbreviation). All approved symbols are stored in the HGNC database,[www.genenames.org](https://www.genenames.org/tools/search), a curated online repository of HGNC-approved gene nomenclature, gene groups and associated resources including links to genomic, proteomic and phenotypic information. Each symbol is unique and we ensure that each gene is only given one approved gene symbol. It is necessary to provide a unique symbol for each gene so that we and others can talk about them, and this also facilitates electronic data retrieval from publications and databases.""    HGNC also provides an index on gene families/groups. GeneGroup IDs do not begin with ""HGNC:"", so care must be made to ensure alignment of concepts when viewing an HGNC ID from an older system that may be referring to the GeneID and not a gene group. For example, 588 refers to the HLA gene family, but HGNC:588 identifies the ATG12 gene. To provide clarity for systems that do not distinguish codes from genes and gene families, use ""http://www.genenames.org"" for genes and ""http://www.genenames.org/genegroup"" for gene families as code system URIs.    For more information on HGNC Gene Groups, see [https://terminology.hl7.org/CodeSystem-HGNCGeneGroup.html](https://terminology.hl7.org/CodeSystem-HGNCGeneGroup.html).    Historically, HGNC gene symbols were used with the HL7 coded data type. For example, in the HL7 messages specified according to the HL7 V2 Clinical Genomics Fully LOINC-Qualified Genetic Variation Model Implementation Guide, HGNC gene symbols were used as the observation values for gene identifiers. For example, OBX 1 CWE 48018-6^Gene identifier^ BRCA1^HGNC. Please note that gene symbols may be present in legacy systems, but GeneID should be used to exchange HGNC gene information in current implementations.    HGNC is a free database for the public.    Versioning Information: The version of the HGNC database is reported using the last updated date. The last updated date is posted on the main HGNC Search screen in the format like ""2024-07-25"".    Current, monthly and quarterly HGNC dataset files are published.    Please see https://www.genenames.org/ for more info.","ValueSet/hgnc-vs"
http://www.genenames.org/genegroup,1.1.0,active,,HGNCGeneGroup,HUGO Gene Nomenclature Committee Gene Group,"""The HGNC is responsible for approving unique symbols and names for human loci, including protein coding genes, ncRNA genes and pseudogenes, to allow unambiguous scientific communication.""    HGNC Gene Group is an index on gene families/groups. The numeric GeneGroup IDs should be used as codes. GeneGroup IDs do not begin with ""HGNC:"" (like the GeneIDs for genes in HGNC Genes), so care must be made to ensure alignment of concepts when viewing an HGNC ID from an older system that may be referring to the GeneID and not a gene group. For example, 588 refers to the HLA gene family, but HGNC:588 identifies the ATG12 gene. To provide clarity for systems that do not distinguish codes from genes and gene families, use ""http://www.genenames.org"" for genes and ""http://www.genenames.org/genegroup"" for gene families as code system URIs.    ""For each known human gene we approve a gene name and symbol (short-form abbreviation). All approved symbols are stored in the HGNC database,[www.genenames.org](https://www.genenames.org/tools/search), a curated online repository of HGNC-approved gene nomenclature, gene groups and associated resources including links to genomic, proteomic and phenotypic information. Each symbol is unique and we ensure that each gene is only given one approved gene symbol. It is necessary to provide a unique symbol for each gene so that we and others can talk about them, and this also facilitates electronic data retrieval from publications and databases.""    For more information on the use of HGNC Genes, see [https://terminology.hl7.org/CodeSystem-v3-hgnc.html](https://terminology.hl7.org/CodeSystem-v3-hgnc.html).    HGNC is a free database for the public.    Please see https://www.genenames.org/ for more info.","ValueSet/hgnc-vs"
http://www.sequenceontology.org,1.0.0,active,,SO,Sequence Ontology,"""The Sequence Ontology is a set of terms and relationships used to describe the features and attributes of biological sequence. SO includes different kinds of features which can be located on the sequence. Biological features are those which are defined by their disposition to be involved in a biological process.""    ""The Sequence Ontologies are provided as a resource to the biological community. They have the following obvious uses:    * To provide for a structured controlled vocabulary for the description of primary annotations of nucleic acid sequence, e.g. the annotations shared by a DAS server ([BioDAS](http://www.biodas.org/documents/das2/das2_protocol.html), [Biosapiens DAS](http://www.biosapiens.info/page.php?page=das_portal)), or annotations encoded by [GFF3](http://www.sequenceontology.org/gff3.shtml).""    * To provide for a structured representation of these annotations within databases. Were genes within model organism databases to be annotated with these terms then it would be possible to query all these databases for, for example, all genes whose transcripts are edited, or trans-spliced, or are bound by a particular protein. One such genomic database is [Chado](http://www.gmod.org/wiki/Chado).    * To provide a structured controlled vocabulary for the description of mutations at both the sequence and more gross level in the context of genomic databases.""    ""The Sequence Ontology is part of [OBO](http://www.obofoundry.org/). It has close links to other ontology projects such as the [RNAO consortium](http://roc.bgsu.edu/), and the [Biosapiens polypeptide features](http://www.ebi.ac.uk/ontology-lookup/browse.do?ontName=BS).""    The content can be browsed [here](http://www.sequenceontology.org/browser/obob.cgi)    The content can be downloaded [here](https://github.com/The-Sequence-Ontology/SO-Ontologies)    For information on contributing, please see [here](https://github.com/The-Sequence-Ontology/SO-Ontologies#contributing)    To request a term or register feedback, see [here](https://github.com/The-Sequence-Ontology/SO-Ontologies/issues)","ValueSet/molecular-consequence-vs,ValueSet/functional-effect-vs,ValueSet/dna-change-type-vs"
https://fhir.bbmri-eric.eu/fhir/CodeSystem/miabis-detailed-samply-type-cs,null,active,,DetailedSampleTypeCS,DetailedSampleType,"Code system for the detailed sample type of a sample","ValueSet/miabis-detailed-sample-type-vs"
https://fhir.kbv.de/CodeSystem/KBV_CS_SFHIR_BMP_DOSIEREINHEIT,1.01,active,"1.2.276.0.76.3.1.1.5.2.41",KBV_CS_SFHIR_BMP_DOSIEREINHEIT,,"Die Schlüsseltabelle enthält eine Liste von kodierten Dosiereinheiten, die im Rahmen der Spezifikation zum bundeseinheitlichen Medikationsplan nach § 31a SGB V zu verwenden sind (vgl. Anhang 4 zu Anlage 3 Vereinbarung BMP). Die Spalte ""Code"" wird im Attribut ""V"", die Spalte ""Einheit Ausdruck"" im Attribut ""DN"", die Spalte  ""Bedeutung"" im Attribut ""bedeutung"" und die Spalte ""Einheit durch AM-Datenbanken unterstützt"" im Attribut ""unterstuetzt"" abgebildet.","ValueSet/DosageDoseQuantityDE"
https://www.meddra.org,3.0.0,active,"2.16.840.1.113883.6.163",MedDRA,Medical Dictionary for Regulatory Activities,"MedDRA is a multilingual standardised international medical terminology which can be used for regulatory communication and evaluation of data pertaining to medicinal products for human use.  MedDRA is designed for use in the registration, documentation and safety monitoring of medicinal products through all phases of the development cycle (i.e., from clinical trials to post-marketing surveillance).#13;   MedDRA is structured as a five level hierarchy. System Organ Classes (SOCs) are the broadest terms (e.g., Cardiac disorders, Investigations). The lowest level of the terminology is the Lowest Level Term (LLT) level.","ValueSet/mii-vs-onko-nebenwirkung-art"
https://www.medizininformatik-initiative.de/fhir/core/modul-person/CodeSystem/Vitalstatus,2026.0.0,active,,MII_CS_Person_Vitalstatus,MII CS Person Vitalstatus,"Vitalstatus des Patienten","ValueSet/mii-vs-person-vitalstatus"
https://www.medizininformatik-initiative.de/fhir/ext/modul-onko/CodeSystem/mii-cs-onko-allgemeiner-leistungszustand-ecog,2026.0.1,active,,MII_CS_Onko_Allgemeiner_Leistungszustand_ECOG,MII CS Onkologie Allgemeiner Leistungszustand ECOG,"oBDS-spezifisches Codesystem für den Allgemeinen Leistungszustand nach ECOG","ValueSet/mii-vs-onko-allgemeiner-leistungszustand-ecog"
https://www.medizininformatik-initiative.de/fhir/ext/modul-onko/CodeSystem/mii-cs-onko-allgemeiner-leistungszustand-karnofsky,2026.0.1,active,,MII_CS_Onko_Allgemeiner_Leistungszustand_Karnofsky,MII CS Onkologie Allgemeiner Leistungszustand Karnofsky,"oBDS-spezifisches Codesystem für den Allgemeinen Leistungszustand nach Karnofsky","ValueSet/mii-vs-onko-allgemeiner-leistungszustand-karnofsky"
https://www.medizininformatik-initiative.de/fhir/ext/modul-onko/CodeSystem/mii-cs-onko-asa-obds,2026.0.1,active,,MII_CS_Onko_ASA_oBDS,MII CS Onkologie ASA-Klassifikation oBDS,"oBDS-basiertes CodeSystem für ASA-Klassifikation (ursprünglich KR9 aus Kolorektales Karzinom Modul, generalisiert für alle onkologischen Indikationen)","ValueSet/mii-vs-onko-asa-obds"
https://www.medizininformatik-initiative.de/fhir/ext/modul-onko/CodeSystem/mii-cs-onko-fernmetastasen,2026.0.1,active,,MII_CS_Onko_Fernmetastasen,MII CS Onkologie Fernmetastasen,"oBDS-spezifisches Codesystem für Fernmetastasen, basierend auf Spezifikation durch TNM-Klassifikation","ValueSet/mii-vs-onko-fernmetastasen"
https://www.medizininformatik-initiative.de/fhir/ext/modul-onko/CodeSystem/mii-cs-onko-genetische-variante-auspraegung,2026.0.1,active,,MII_CS_Onko_Genetische_Variante_Auspraegung,MII CS Onkologie Genetische Variante Ausprägung,"oBDS-spezifisches Codesystem Konsequenz der genetischen Variante Ausprägung","ValueSet/mii-vs-onko-genetische-variante-auspraegung"
https://www.medizininformatik-initiative.de/fhir/ext/modul-onko/CodeSystem/mii-cs-onko-grading,2026.0.1,active,,MII_CS_Onko_Grading,MII CS Onkologie Grading,"Codes für Histologie Grading. Gibt den Differenzierungsgrad des Tumors entsprechend der aktuellen TNM-Auflage an.","ValueSet/mii-vs-onko-grading"
https://www.medizininformatik-initiative.de/fhir/ext/modul-onko/CodeSystem/mii-cs-onko-intention,2026.0.1,active,,MII_CS_Onko_Intention,MII CS Onkologie Intention,"oBDS-spezifisches Codesystem für Klassifikation von Intention der OP, der Strahlentherapie und der Systemischen Therapie.","ValueSet/mii-vs-onko-systemische-therapie-intention,ValueSet/mii-vs-onko-strahlentherapie-intention,ValueSet/mii-vs-onko-operation-intention"
https://www.medizininformatik-initiative.de/fhir/ext/modul-onko/CodeSystem/mii-cs-onko-krk-anastomoseninsuffizienz,2026.0.1,active,,MII_CS_Onko_KRK_Anastomoseninsuffizienz,MII CS Onkologie KRK Anastomoseninsuffizienz,"oBDS-spezifisches Codesystem für Anastomoseninsuffizienz beim Kolorektalen Karzinom","ValueSet/mii-vs-onko-krk-anastomoseninsuffizienz"
https://www.medizininformatik-initiative.de/fhir/ext/modul-onko/CodeSystem/mii-cs-onko-krk-mrt-mesorektale-faszie-status,2026.0.1,active,,MII_CS_Onko_KRK_MRT_Mesorektale_Faszie_Status,,"oBDS-basiertes Codesystem für den Status der MRT/CT Untersuchung zur mesorektalen Faszie beim Kolorektalen Karzinom (KR5)","ValueSet/mii-vs-onko-krk-mrt-mesorektale-faszie-status"
https://www.medizininformatik-initiative.de/fhir/ext/modul-onko/CodeSystem/mii-cs-onko-krk-tme-qualitaet,2026.0.1,active,,MII_CS_Onko_KRK_TME_Qualitaet,MII CS Onkologie TME Qualität,"oBDS-spezifisches Codesystem TME-Präparat, basierend auf der S3-Leitlinie Mammakarzinom v","ValueSet/mii-vs-onko-krk-tme-qualitaet"
https://www.medizininformatik-initiative.de/fhir/ext/modul-onko/CodeSystem/mii-cs-onko-mamma-her2neu-status-leitlinie,2026.0.1,active,,MII_CS_Onko_Mamma_Her2neu_Status_Leitlinie,MII CS Onkologie Mamma Her2neu Status Leitlinie,"Codesystem für Her2neu Status basierend auf der S3-Leitlinie Mammakarzinom und ASCO/CAP Guidelines mit erweiterten Klassifikationen (HER2-low, HER2-ultralow)","ValueSet/mii-vs-onko-mamma-her2neu-status-leitlinie"
https://www.medizininformatik-initiative.de/fhir/ext/modul-onko/CodeSystem/mii-cs-onko-mamma-her2neu-status-obds,2026.0.1,active,,MII_CS_Onko_Mamma_Her2neu_Status_oBDS,MII CS Onkologie Mamma Her2neu Status oBDS,"oBDS-spezifisches Codesystem für Her2neu Status gemäß oBDS Feld M4 (243)","ValueSet/mii-vs-onko-mamma-her2neu-status-obds"
https://www.medizininformatik-initiative.de/fhir/ext/modul-onko/CodeSystem/mii-cs-onko-mamma-rezeptorstatus-leitlinie,2026.0.1,active,,MII_CS_Onko_Mamma_Rezeptorstatus_Leitlinie,MII CS Onkologie Mamma Rezeptorstatus,"oBDS-spezifisches Codesystem Mamma-Rezeptorstatus, basierend auf der S3-Leitlinie Mammakarzinom v5.02 Abschnitt 4.5.4","ValueSet/mii-vs-onko-mamma-rezeptorstatus-leitlinie"
https://www.medizininformatik-initiative.de/fhir/ext/modul-onko/CodeSystem/mii-cs-onko-melanom-ulzeration,2026.0.1,active,,MII_CS_Onko_Melanom_Ulzeration,MII CS Onkologie Melanom Ulzeration,"Codes für die Ulzeration beim Malignen Melanom der Haut nach oBDS","ValueSet/mii-vs-onko-melanom-ulzeration"
https://www.medizininformatik-initiative.de/fhir/ext/modul-onko/CodeSystem/mii-cs-onko-nebenwirkung-ctcae-grad,2026.0.1,active,,MII_CS_Onko_Nebenwirkung_CTCAE_Grad,MII CS Onko Nebenwirkung nach CTCAE-Grad,"Gibt an, zu welchem Schweregrad von Nebenwirkungen es bei der Bestrahlung oder der systemischen Therapie gekommen ist.","ValueSet/mii-vs-onko-nebenwirkung-ctcae-grad"
